{
  "model": "CausalBind",
  "assignee_id": "03-causalbind",
  "stage": "A2_reproduce",
  "environment": {
    "python": "3.11.8",
    "torch": "2.7.0+cu118",
    "cuda": "11.8",
    "gpu": "NVIDIA GeForce RTX 3060, 12288 MiB (shared with the desktop session)",
    "lockfile": "A1_env/environment.yml",
    "notes": "Same machine and environment as A1. Pretrained backbones: Uni-Mol v0.1 mol_pre_no_h_220816.pt (sha256 da27196af09a8c6d089e10b7764b6a716bcc33da227fc118f5b45b0e484585e9), pocket_pre_220816.pt (sha256 8d1bb06516d931d816f19e9c2f2bd5fcc2577d8875b714e15503f2ca9a0d2fce), ESM-2 facebook/esm2_t12_35M_UR50D at revision 6fbf070e65b0b7291e7bbcd451118c216cff79d8. Benchmark index files from LigUnity main at 8ae35edba5481aa13de8a5bac6b03c1c1860ef3c. dude.zip md5 5d57baa932a38ce2262095b09b67d933, pcba.zip md5 5fe73a1365309306493297761c10a84e (LigUnity Google Drive), DEKOIS_2.0x.zip md5 bc334226eb8dbdedf00473ac7d2e9b10. Checkpoint from Hugging Face LokaLi/CausalBind at revision 000181dcf62caabdf3505cb3d1176720292faee9; its sha256 matches the LFS sha256 Hugging Face publishes.",
    "source_digest_ok": "train_label.zip md5 ead04f9c50789bdb7b2c0784e2174be6; apply_variant.py --check-source pocketaffdb_ligandish: train_label_blend_seq_full.json 26,748 entries, digest 9f9df3bbb40393a0e0952db324690ceeda67cd0be336fd72d68a54b9eab0ab5a; train_label_pdbbind_seq.json 16,744 entries, digest a59bd2161d1a2fd2cc430ab374fb76c33eb94f61109b6fbeafed9fecc64dcdd6"
  },
  "code": {
    "upstream_url": "https://github.com/lokali/CausalBind",
    "upstream_commit": "01fe8e93ca261f990e37ba3df7e7024cc5fa36dd",
    "changes_diff_sha256": "f665793bf1b820f569c16c1a913160da6f3fa63f5511d7be7ac09136df3cf268",
    "changes_justified": true
  },
  "run": {
    "seed": 1,
    "checkpoint_rule": "last",
    "checkpoint_rule_source": "assignments/03-causalbind.md (Notes: score checkpoint_last.pt); CausalBind README 'Evaluation' and DATA.md 'Train/Test Protocol': the paper reports the last checkpoint (epoch 50) of each run; arXiv:2610.07340 Section 4 (p. 8): the main tables report the last checkpoint",
    "checkpoint_sha256": "cc89bd6c3b04bcaa5477aa351db54410b248841b7a77b828e90c73b1a2b8abd4",
    "command_file": "code/run.sh",
    "wall_clock_hours": 1.48,
    "gpu_hours": 1.48
  },
  "results": [
    {
      "benchmark": "DUD-E",
      "n_targets": 102,
      "per_target_csv": "per_target_DUDE.csv",
      "metrics": {
        "auroc": 0.9354613183493296,
        "bedroc": 0.7439573438660618,
        "ef_0.005": 51.04783999028967,
        "ef_0.01": 47.687893167178565,
        "ef_0.02": 34.57404637658445,
        "ef_0.05": 15.720606373951583
      },
      "bedroc_alpha": 80.5,
      "published_reference": {
        "metric": "ef_0.01 (EF@1%)",
        "value": 47.69,
        "source": "arXiv:2610.07340, Table 1 (p. 8), CausalBind-SP row, DUD-E (n=102); seed 1, last checkpoint (Table A4, p. 40)",
        "relative_gap_pct": -0.0044,
        "gate": true
      }
    },
    {
      "benchmark": "LIT-PCBA",
      "n_targets": 15,
      "per_target_csv": "per_target_PCBA.csv",
      "metrics": {
        "auroc": 0.6395355237876882,
        "bedroc": 0.09646023080611624,
        "ef_0.005": 10.884005190024249,
        "ef_0.01": 8.559413096157861,
        "ef_0.02": 6.052834817863423,
        "ef_0.05": 3.6882707774458408
      },
      "bedroc_alpha": 80.5,
      "published_reference": {
        "metric": "ef_0.01 (EF@1%)",
        "value": 8.56,
        "source": "arXiv:2610.07340, Table 1 (p. 8), CausalBind-SP row, LIT-PCBA (n=15); AUROC 0.639 and BEDROC 0.097 in the same row",
        "relative_gap_pct": -0.0069,
        "gate": false
      }
    },
    {
      "benchmark": "DEKOIS 2.0, 9-target OOD subset",
      "n_targets": 9,
      "per_target_csv": "per_target_DEKOIS_OOD9.csv",
      "metrics": {
        "auroc": 0.8596555555555556,
        "bedroc": 0.6574444444444444,
        "ef_0.005": 24.329483054483052,
        "ef_0.01": 23.001576576576575,
        "ef_0.02": 20.010852852852853,
        "ef_0.05": 12.138196260776906
      },
      "bedroc_alpha": 80.5,
      "published_reference": {
        "metric": "auroc",
        "value": 0.86,
        "source": "arXiv:2610.07340, Table A13 (p. 47), target-level OOD subset (11BETAHSD1, ACE2, ADRB2, ALR2, COX1, CYP2A6, INHA, MMP2, TK), CausalBind-SP; BEDROC 0.658 and EF@1% 23.00 in the same row. Means taken over the 9 rows of the full 81-target run (per_target_DEKOIS.csv)",
        "relative_gap_pct": -0.0401,
        "gate": false
      }
    },
    {
      "benchmark": "Merck-FEP-8",
      "n_targets": 8,
      "per_target_csv": "per_target_FEP_Merck8.csv",
      "metrics": {
        "pearson_r": 0.59779625,
        "spearman_rho": 0.5474275
      },
      "published_reference": {
        "metric": "pearson_r",
        "value": 0.598,
        "source": "arXiv:2610.07340, Table A11 (p. 46), Merck-FEP-8, CausalBind-SP; Spearman rho 0.548 in the same row. All 16 FEP targets are in per_target_FEP.csv",
        "relative_gap_pct": -0.0341,
        "gate": false
      }
    }
  ],
  "problems": [
    "dude.json (LigUnity main 8ae35edb) maps CSF1R to P11362, which is FGFR1's UniProt ID (CSF1R is P07333), so CSF1R is scored with the FGFR1 sequence; left unchanged, since the published numbers come from the same file",
    "test_task.py prints per-target AUC and BEDROC to 4 decimals, so the means of those per_target columns differ from the logged means in the 6th decimal; EF is printed in full and its means match exactly",
    "The DUD-E log is missing its exit-code and end-time lines (those commands were not run); the run printed every mean and the process ended normally, and the end time 00:31:22 is the log's last write",
    "scripts/download_data.sh skips any file that is already non-empty, so an interrupted download is never resumed or replaced; the slow DEKOIS_2.0x.zip (figshare, about 200 KB/s) finished in one go and its md5 was checked",
    "scripts/download_data.sh does not fetch test_datasets/FEP (fep_labels.json, lmdbs/), which DATA.md names as the FEP source; taken from LigUnity at 8ae35edb. The bench/ CSVs test_fep_target reads for ACC/AUC are not published, so ACC/AUC are NaN; Pearson r and Spearman rho are unaffected (as the paper states, p. 46)",
    "The released DEKOIS_2.0x LMDBs hold fewer than the 1,240 molecules (40 actives + 1,200 decoys) per target that DEKOIS 2.0 defines for 36 of the 81 targets; 11betahsd1, 17betahsd1 and sars-hcov also lack 3, 1 and 1 actives. Scored as released; the counts are in per_target_DEKOIS.csv",
    "The DUD-E CSV counts 22,800 actives over the 102 targets, against 22,886 in the DUD-E release; scored as released",
    "Table A13 (p. 47) also reports a 6-target scaffold-level DEKOIS subset but does not name the targets, so it is not compared",
    "The paper's Table 2 caption says five runs, while Table A16 gives n=4 for the multi-seed SP numbers (EF@1% 47.99 +- 0.39); the gate uses the seed-1 number of Table 1",
    "A2 used 1.48 GPU-hours on the RTX 3060 (DUD-E 0.53, LIT-PCBA 0.90, DEKOIS 0.04, FEP 0.002), over the 1 GPU-hour checkpoint-A budget; recorded here rather than raised separately, since the overrun is small"
  ]
}
