{
  "model": "CausalBind",
  "assignee_id": "03-causalbind",
  "stage": "A3_smoke",
  "environment": {
    "python": "3.11.8",
    "torch": "2.7.0+cu118",
    "cuda": "11.8",
    "gpu": "NVIDIA A100-SXM4-80GB, 81920 MiB (Vast.ai instance 57482916, driver 535.230.02)",
    "lockfile": "A3_smoke/environment.yml",
    "notes": "Rebuilt from code/run.sh on a rented machine (image nvidia/cuda:11.8.0-cudnn8-devel-ubuntu22.04). conda 26.9.4 (Miniforge latest; A1 had 26.7.2). The CUDA toolkit was hidden while conda env create ran, so torchsort built its CPU extension only, as on the A1 machine. A3_smoke/lockfile_diff.txt against A1: only the env prefix and the setuptools egg Uni-Core's install fetches (84.2.1, A1 84.0.0); every pinned package is the same version. Pretrained backbone sha256s and DEKOIS md5 equal A2; the 8 training-data files match the figshare md5s.",
    "source_digest_ok": "on the A3 machine as at A2: train_label.zip md5 ead04f9c50789bdb7b2c0784e2174be6; apply_variant.py --check-source pocketaffdb_ligandish: train_label_blend_seq_full.json 26,748 entries, digest 9f9df3bbb40393a0e0952db324690ceeda67cd0be336fd72d68a54b9eab0ab5a; train_label_pdbbind_seq.json 16,744 entries, digest a59bd2161d1a2fd2cc430ab374fb76c33eb94f61109b6fbeafed9fecc64dcdd6"
  },
  "code": {
    "upstream_url": "https://github.com/lokali/CausalBind",
    "upstream_commit": "01fe8e93ca261f990e37ba3df7e7024cc5fa36dd",
    "changes_diff_sha256": "f665793bf1b820f569c16c1a913160da6f3fa63f5511d7be7ac09136df3cf268",
    "changes_justified": true
  },
  "run": {
    "seed": 1,
    "checkpoint_rule": "last",
    "checkpoint_rule_source": "assignments/03-causalbind.md (Notes: score checkpoint_last.pt); CausalBind README 'Evaluation' and DATA.md 'Train/Test Protocol': the paper reports the last checkpoint (epoch 50) of each run; arXiv:2610.07340 Section 4 (p. 8): the main tables report the last checkpoint",
    "checkpoint_sha256": "f3fba02c18c596fbfbfcd96f57a856cd9218b485bfbd53753b07b1be2cacd2ad",
    "epochs": 1,
    "batch_size": 24,
    "update_freq": 1,
    "command_file": "code/run.sh",
    "wall_clock_hours": 1.2,
    "gpu_hours": 1.2
  },
  "results": [],
  "problems": [
    "conda env create failed on the rented machine: torchsort==0.1.10 is source-only, pip builds it in an isolated env with the latest torch (CUDA 13.0), and with the image's nvcc 11.8 on the path it also builds a CUDA kernel, which torch refuses (CUDA version mismatch). The A1 machine has no CUDA toolkit, so it built only the CPU extension there. /usr/local/cuda was moved aside for that one command, giving the same build; environment.yml and code/changes.diff are unchanged",
    "Miniforge is installed from releases/latest, which moved from conda 26.7.2 (A1) to 26.9.4 (A3); the environment itself is pinned and came out the same",
    "Uni-Core's python setup.py install fetches the newest setuptools as an egg: 84.2.1 here, 84.0.0 at A1; the active setuptools is 75.8.0 in both",
    "PairDataset reads DATA_DIR/cache/{mol_smi2idx,pocket_name2idx}_train_blend.json, but download_data.sh saves the released copies in data/; without them the first run rebuilds both on one CPU core (10.6 min here, before the first update). The rebuilt files are byte-identical to the released ones, so B and C can place the released files in data/cache/",
    "A first version of code/check_index_cache.py looked records up by the key str(idx), as the evaluator's unimol LMDBDataset does, and reported every sample as mismatched; train_task.py uses unicore.data.LMDBDataset, which indexes in LMDB key order. Corrected in commit d834484; the corrected check and a byte comparison with the rebuilt files both pass",
    "Each training checkpoint is 3.16 GB (it holds the optimizer state). scripts/train.sh keeps every epoch (--keep-last-epochs 50) and up to 8 best checkpoints, about 190 GB per 50-epoch run",
    "Scoring the 3.16 GB smoke checkpoint on DEKOIS took 4.7 min on the A100 against 2.7 min for the 0.57 GB released checkpoint on the RTX 3060; not investigated (load time and the live UniProt fetch on a fresh machine are both included)",
    "Checkpoint A total is about 2.7 GPU-hours (A2 1.48 on the RTX 3060, A3 1.2 on the A100), over the 1 GPU-hour budget; of the A3 hour, GPU compute was under 6 minutes (training 20 s, reload scoring 4.7 min), the rest environment build, downloads and the index rebuild"
  ]
}
